Id,neg,neu,pos,compound,overall,verified,reviewTime,reviewerID,asin,style,reviewerName,reviewText,summary,unixReviewTime,vote,image,target_compound,rank,title
399,0.0,1.0,0.0,0.0,1.0,False,"04 30, 2006",A2K44AH9XLQ5WV,0061900621,{'Format:': ' Hardcover'},Happy Mama,"Simply doesn't apply to our family, we don't feed babies this way.",Could do without the bottle feeding,1146355200,51,,0.1,23.0,I'm a Big Sister
245,0.0,0.954,0.046,0.2023,5.0,False,"11 30, 2014",ASC5GQUB1ZPPD,0061900621,{'Format:': ' Hardcover'},Dr. D,Bringing home a new baby needs to be handled with kid gloves for a 2 year old big sister. This book really helped my granddaughter understand her new baby sister wasn't coming home and playing dolls or eating pizza with her.,"Lets the ""little"" big sister know what to expect.",1417305600,,,0.1,23.0,I'm a Big Sister
43,0.0,0.923,0.077,0.3291,5.0,True,"12 17, 2016",A1E38ETRELK0OU,0061900621,{'Format:': ' Hardcover'},Erin,"My daughter loves this book, and I got it used for much cheaper and it only had slight tear on one of the pages but still looked brand new otherwise.",Great books for big sisters to be!,1481932800,,,0.3,23.0,I'm a Big Sister
223,0.0,0.938,0.062,0.34,5.0,True,"02 3, 2015",AAA3AXHBVOUC5,0061900621,{'Format:': ' Hardcover'},Jan Swanson,My daughter is a big sister and she is giving this book to the next generation of big sisters. The new baby always gets something and we started a tradition to give an appropriate book to the older sibling.,My daughter is a big sister and she is giving ...,1422921600,,,0.3,23.0,I'm a Big Sister
387,0.019,0.932,0.049,0.4945,5.0,False,"05 5, 2008",A1UIUISV9DV8RH,0061900621,{'Format:': ' Hardcover'},Buy all the things!,"This book among a couple of others really helped my daughter after her little sister was born. It was especially hard on her because she was an only child for 5 years, but this book explains exactly what she needed to know about being a big sister. Including the fact that she is still just as special to me as the baby is, even though I can't give her the attention I used to.",Great for new siblings,1209945600,,,0.5,23.0,I'm a Big Sister
131,0.0,0.814,0.186,0.4939,5.0,True,"12 4, 2015",A5FXVXX10FMQ1,0061900621,{'Format:': ' Hardcover'},Shopaholic55,This book is adorable. My toddler wanted me to read it over and over again.,Five Stars,1449187200,,,0.5,23.0,I'm a Big Sister
53,0.0,0.0,1.0,0.7003,4.0,True,"09 29, 2016",ANIRELKAL9FBK,0061900621,{'Format:': ' Hardcover'},WALSH,good gift,Four Stars,1475107200,,,0.7,23.0,I'm a Big Sister
132,0.0,0.868,0.132,0.7003,5.0,True,"12 2, 2015",ASOZGP0BBWA95,0061900621,{'Format:': ' Hardcover'},Kaitlin Burns,"We are due with our second and our two year old loves this book. When we started reading this, it seemed to really register that she has a sister coming and has impacted how she reacts to other babies as well.",We are due with our second and our two year ...,1449014400,,,0.7,23.0,I'm a Big Sister
153,0.0,0.667,0.333,0.8997,5.0,True,"09 25, 2015",A3AKLUQA47JQSN,0061900621,{'Format:': ' Hardcover'},IslandLiving,Our daughter loves this book!  It helps show the role she will play as a big sister and highlights how mom and dad will always think she is special!,Great story highlighting the new roles a big sister will get to do and highlights big sis will always be loved,1443139200,,,0.9,23.0,I'm a Big Sister
202,0.0,0.725,0.275,0.8997,5.0,True,"03 29, 2015",A22E6809OJVHYD,0061900621,{'Format:': ' Hardcover'},Daphne M. Caldwell,"Cute little books! I bought this and the ""I'm a Big Brother"" for our children when announcing our third pregnancy. So adorable and the children love to hear about something that relates with them.",Perfect for Breaking the News to Your Little One,1427587200,,,0.9,23.0,I'm a Big Sister
675,0.046,0.9,0.055,0.12,3.0,True,"10 15, 2014",A907M3K2FN3ZM,0062110721,{'Format:': ' Paperback'},brazilianmom,"Out of all the Pete the Cat series, this is one of my least favorites. It has a slower rhythm, if you've read other Pete the Cat books you'll know what I mean. When I am reading this for my son, I always can't wait for this book to be over. lol","Out of all the Pete the Cat series, this ...",1413331200,,,0.1,38.0,Pete the Cat: Pete at the Beach (My First I Can Read)
476,0.096,0.764,0.14,0.2579,5.0,False,"07 3, 2017",A13SR0F0BN9X8T,0062110721,{'Format:': ' Paperback'},JMW,"within on month, my child age 6 read this book and is her favorite! Now she reads to everyone without help",builds self confidence,1499040000,,,0.1,38.0,Pete the Cat: Pete at the Beach (My First I Can Read)
740,0.205,0.554,0.242,0.2951,5.0,True,"10 14, 2013",A24SIX4NYH9DNX,0062110721,{'Format:': ' Paperback'},Jodie Sipes,who doesnt love pete? great book TO ENGAGE THE CHILDREN AND KEEP THEM WANTING MORE! BUY IT TODAY YOU WILL BE HAPPY,Pete the Cat: Pete at the Beach (My First I Can Read),1381708800,,,0.3,38.0,Pete the Cat: Pete at the Beach (My First I Can Read)
544,0.115,0.706,0.179,0.2937,5.0,True,"03 1, 2016",A11M65RJ4YR5KU,0062110721,{'Format:': ' Paperback'},Janice,What's not to like? These Pete the Cat books are fun reading for beginning readers.,Five Stars,1456790400,,,0.3,38.0,Pete the Cat: Pete at the Beach (My First I Can Read)
685,0.087,0.714,0.199,0.4933,3.0,False,"08 21, 2014",AJQTLJQAU4KRF,0062110721,{'Format:': ' Paperback'},Kindle Customer,Not quiet as good as some of the other Pete the cat books but still OK.,"Not as good as other Pete the cat books, just Ok.",1408579200,,,0.5,38.0,Pete the Cat: Pete at the Beach (My First I Can Read)
650,0.0,0.484,0.516,0.4926,5.0,True,"12 29, 2014",A3E2FPVQ9MD2I7,0062110721,{'Format:': ' Paperback'},Wes Wischnofske,"Just as expected, thanks!","Just as expected, thanks!",1419811200,,,0.5,38.0,Pete the Cat: Pete at the Beach (My First I Can Read)
756,0.0,0.775,0.225,0.7003,5.0,True,"08 1, 2013",A3ND5YQJ4FVHS3,0062110721,{'Format:': ' Paperback'},Ida J Recu,Everybody loves Pete the Cat. Even the grown-ups as well as my daughter's class of school children. Buy it for your kids.,Pete the Cat: Pete at the Beach,1375315200,,,0.7,38.0,Pete the Cat: Pete at the Beach (My First I Can Read)
625,0.0,0.633,0.367,0.7003,5.0,True,"03 10, 2015",A1GY594C2RT5YD,0062110721,{'Format:': ' Paperback'},Vicki Wilson,The book came quickly and was packaged well. Grandson loves this series.,Great Book.,1425945600,,,0.7,38.0,Pete the Cat: Pete at the Beach (My First I Can Read)
751,0.0,0.643,0.357,0.9022,4.0,True,"08 17, 2013",A1XEPHNBPL9IBJ,0062110721,{'Format:': ' Paperback'},Rose,"All of the Pete the cat books are fun. Children feel a great deal of success in reading when they can read a ""whole"" book.",pete the cat at the beach,1376697600,,,0.9,38.0,Pete the Cat: Pete at the Beach (My First I Can Read)
517,0.066,0.803,0.131,0.904,3.0,False,"09 10, 2016",ALUZO8SLEA7S4,0062110721,{'Format:': ' Paperback'},cree,"We typically love Pete the Cat, and have all of the large books written by the original co-authors.  Unfortunately, since authorship has changed it seems the content of the Pete books has faded a bit.  While they're still fine as far as children's books go, the later books (including this one) seem to be missing some of the really imaginative, endearing qualities of the initial series.

There's not much content to this book really.  Pete goes to the beach.  He doesn't want to surf.  Then he ends up trying it.  There are none of the cute little phrases or quips that I've come to appreciate in Pete the Cat books.

The newer Pete stories, this one particularly, seem to be missing something.  Hopefully they'll be able to get back the charm that made Pete such a lovable character to begin with!",NOT ONE OF THE BETTER PETE BOOKS,1473465600,8,"['https://images-na.ssl-images-amazon.com/images/I/81arMeNERcL._SY88.jpg', 'https://images-na.ssl-images-amazon.com/images/I/81vuVoJLdBL._SY88.jpg']",0.9,38.0,Pete the Cat: Pete at the Beach (My First I Can Read)
811,0.0,1.0,0.0,0.0,3.0,True,"11 13, 2017",A2V9GJEJ0KAAIN,0142405809,{'Format:': ' Paperback'},B. Kolvek &amp;amp;amp; Family,Why is the whale a he? why is the snail a she?,Three Stars,1510531200,,,0.1,13.0,The Snail and the Whale
812,0.0,0.808,0.192,0.2263,4.0,True,"11 8, 2017",A30VM0TL0DMY3M,0142405809,{'Format:': ' Board book'},Wahid Momand,Nice story but the text is way too small,Four Stars,1510099200,,,0.1,13.0,The Snail and the Whale
820,0.0,0.466,0.534,0.3164,4.0,True,"10 1, 2017",AQEUZMAUJIWFO,0142405809,{'Format:': ' Paperback'},mistyb,Cute but short!,Four Stars,1506816000,,,0.3,13.0,The Snail and the Whale
833,0.0,0.465,0.535,0.3182,5.0,True,"07 28, 2017",A1S4EBOA5X4B14,0142405809,{'Format:': ' Paperback'},Celia F. Bitter,What an adventure.,Five Stars,1501200000,,,0.3,13.0,The Snail and the Whale
893,0.0,0.842,0.158,0.4926,4.0,True,"10 20, 2016",A1WTINXJONW86Q,0142405809,{'Format:': ' Hardcover'},KDM,"Although I found the book entertaining, the real connoisseur of children's literature, my granddaughter, was less enthralled. Go figure!",Entertaining,1476921600,,,0.5,13.0,The Snail and the Whale
1006,0.026,0.879,0.095,0.508,2.0,True,"05 20, 2015",A3E9I7FP96XVUH,0142405809,{'Format:': ' Paperback'},Rachel Handing,"We bought this book because we are VERY fond of other Julia Donaldson books and this one fell flat for us.  The story line isn't all that interesting and a lot of the word play gets your mouth jumbled up (think like reading a Dr. Seuss book, but not funny).  We always pass on this book and probably will donate soon.",The story line isn't all that interesting and a lot of the word play gets your mouth jumbled up (think like reading a Dr,1432080000,,,0.5,13.0,The Snail and the Whale
1054,0.0,0.756,0.244,0.7003,4.0,False,"07 30, 2014",A2U1YALT31VVSQ,0142405809,{'Format:': ' Paperback'},Tomxypdq,"other books by this author artist duo are better, this one still better than many other books by other authors","other books by this author artist duo are better, this one still better than many other books ...",1406678400,,,0.7,13.0,The Snail and the Whale
881,0.0,0.408,0.592,0.7003,5.0,True,"01 3, 2017",A1T947G26AEAQ3,0142405809,{'Format:': ' Paperback'},C. Layton,I like the rhyming & fun story line,Fun!,1483401600,,,0.7,13.0,The Snail and the Whale
1066,0.0,0.698,0.302,0.9022,5.0,True,"05 2, 2014",A1E9TDQUAHSBOI,0142405809,{'Format:': ' Paperback'},Lauretta Prince,I read it to her and it held her interest until the end. The story was cute with and nice ending.  The illustrations were very colorful.  I'd say we both enjoyed the book,i bought kThe Snail and the Whale for my four year old granddaughter.,1398988800,,,0.9,13.0,The Snail and the Whale
1091,0.027,0.785,0.188,0.8978,5.0,True,"07 8, 2013",A3QUWYRQIO39E8,0142405809,{'Format:': ' Paperback'},Heather,"The first half of the story reads like a journey or sea shanty for a snail and a whale.  With a ""sniff and a sigh"". So cute. Later, the journey puts the whale in danger and the snail becomes an advocate to save the whale. His little voice is heard and children come running to save the whale.  A great book simply for the rhyming but also fun for older kids as a model of environmental activism.",Adorable snail adventure and actovist heroics for class of kids,1373241600,,,0.9,13.0,The Snail and the Whale
1315,0.105,0.769,0.126,0.1202,3.0,False,"06 10, 2015",A1U5GBB6VX9FEL,014242286X,{'Format:': ' Paperback'},Doug Warren,"I read this because several girls in my class have read it, and some of them have come up to me pointing at a word or sentence and asking what it means, and um, yeah. It peaked my curiosity.

The book is really good, but not great. Definitely subject matter that some parents would need to be concerned about, but I think most kids who pick it up will be mature enough for it. You can definitely tell the author has some post-Modern influences, which is unusual to see in a YA novel, but the changing narrator and non-connected story line (at least at the beginning) work.

The ending was so stupid and such a cop out, though. It is insulting to the rest of the book. The whole book is real and dealing with issues, and you can think of how the book could in and be happy, but the author over does it. Throws in way too many things. And the happy ending you are wanting is ruined because there is just so much thrown into it.",Definitely drew me in at first . . . then . . .,1433894400,4,,0.1,21.0,Counting by 7s
1222,0.0,1.0,0.0,0.0,2.0,True,"08 22, 2016",AKMAFCOTE87O2,014242286X,{'Format:': ' Paperback'},CreativeMom,not my favoret,Two Stars,1471824000,,,0.1,21.0,Counting by 7s
1224,0.0,0.0,1.0,0.296,4.0,True,"08 9, 2016",A2N4ZBFUMMDGE6,014242286X,{'Format:': ' Paperback'},William Brinkley,ok,Four Stars,1470700800,,,0.3,21.0,Counting by 7s
1324,0.065,0.858,0.078,0.3153,5.0,False,"04 28, 2015",A14GD5FUN5S0QW,014242286X,{'Format:': ' Paperback'},Candice Slater,"I am reading this book called Counting By 7sby by Holly Goldberg Sloan. The beginning of the book is about Willow, the main character, and about she came to be at the position that she is at now. My favorite character is Willow because we share so much in common. The only part that i didn't like was that the book switches points of view and so it was kind of confusing at first. I would recommend this book to people who like Drama because this book has a lot of drama.

By: Abigail M.",My favorite character is Willow because we share so much in ...,1430179200,,,0.3,21.0,Counting by 7s
1478,0.066,0.86,0.075,0.5063,5.0,False,"09 27, 2013",A2G7BG9AECUM06,014242286X,{'Format:': ' Hardcover'},E. Kennen,"Willow is a genius who's observational skills and medical prowess make Sherlock Homes and House, MD look like amateurs. A lover of life, she is a gifted horticulturalist. What she's not so good at, however, is understanding how people work. Which is too bad because, having the particularly horrendous luck of being orphaned twice, she must now navigate through unimaginable pain and loss while unmoored to any particular community.

Except... maybe Willow does have more support than she first realizes, from the most unlikely sources: a taxi driver who thinks she's his guardian angel; an inept, angry guidance counselor; and a Vietnamese family who live in the garage behind their mother's nail salon.

Willow thinks so differently than most people that I can imagine some young readers will find her offputting... at first. But her quirks and logic are entirely endearing and soon begin to feel natural... to everyone, except Willow herself. Her first person narrative is divided by third-person glimpses at the people who's world she's changing... and who are changing her world.
This was a compulsive read - the 300-odd pages just sailed beneath my fingertips. Author Holly Goldberg Sloan does an amazing job of bringing the statistical anomaly that is Willow to life, and of making her feelings and actions seem realistic, while somehow retaining a lightness and hope even in Willow's darkest hours.

Willow might not resonate with every young reader, but to those she does, she will not soon be forgotten.",A Cumpulsive Read,1380240000,,,0.5,21.0,Counting by 7s
1310,0.0,0.0,1.0,0.4926,4.0,True,"06 20, 2015",A1GHSOH846N6OT,014242286X,{'Format:': ' Paperback'},Richard Blair/Jennifer Blair,Thanks!,Four Stars,1434758400,,,0.5,21.0,Counting by 7s
1425,0.0,0.838,0.162,0.6997,5.0,True,"03 14, 2014",A1CD4IHQBARZOE,014242286X,{'Format:': ' Hardcover'},Vm,"Son is an avid reader, and 10 years old.  This was a soulful story that seemed to touch him.  He could not put it down when he got it, and really enjoyed it.",Son loved it.,1394755200,,,0.7,21.0,Counting by 7s
1353,0.222,0.421,0.357,0.7003,5.0,True,"12 12, 2014",A2EXIPY3PVHXZE,014242286X,{'Format:': ' Kindle Edition'},jessi,"Every one ...... I recommend this book it is great it made me cry tears of sadness and happiness.
You will like it",Fab,1418342400,,,0.7,21.0,Counting by 7s
1432,0.0,0.814,0.186,0.9001,5.0,True,"02 17, 2014",A3JGPZX9AB7YDH,014242286X,{'Format:': ' Kindle Edition'},C.T.,I read the synopsis. I knew what the book was supposed to be about. And then I read it. Not just one life. This is such a blended story. A story about how people can blend together and become an unconventional family. I found myself laughing out loud because of the delight in this story. Sheer delight.,How can one story touch so many places in your heart?,1392595200,,,0.9,21.0,Counting by 7s
1200,0.0,0.539,0.461,0.8999,5.0,True,"12 27, 2016",AAUF8KJRY4ZLQ,014242286X,{'Format:': ' Kindle Edition'},Joslyne b,Nice story with a happy ending that gives a somewhat offbeat main character a relatable place in her world. Definitely recommend!,Great book for tweens,1482796800,,,0.9,21.0,Counting by 7s
1706,0.113,0.739,0.148,0.2003,5.0,True,"08 1, 2016",AQRZ79Y4SDDZ1,0147510481,{'Format:': ' Kindle Edition'},avery allison,It was thrilling! It was so moving to think about and I cried at some parts. It was a real story.,Loved it!,1470009600,,,0.1,26.0,The War That Saved My Life
1637,0.0,0.656,0.344,0.2732,5.0,True,"01 9, 2017",A3OE0TA7SI2QMK,0147510481,{'Format:': ' Paperback'},Charity C,Well written and very educational.,Five Stars,1483920000,,,0.1,26.0,The War That Saved My Life
1783,0.205,0.492,0.303,0.296,5.0,True,"03 8, 2016",A10QVW3X5QACNP,0147510481,{'Format:': ' Hardcover'},CS,Wonderful story.told during a difficult time in our history,Wonderful story. told during a difficult time in our,1457395200,,,0.3,26.0,The War That Saved My Life
1852,0.0,0.697,0.303,0.2905,5.0,True,"02 20, 2015",A3J018YZ5PJ8X4,0147510481,{'Format:': ' Kindle Edition'},Amazon Customer,This book was touching.  I want a sequel!!!,Five Stars,1424390400,,,0.3,26.0,The War That Saved My Life
1555,0.096,0.741,0.162,0.4939,5.0,True,"10 12, 2017",A3GRW8BO3GCQ3,0147510481,{'Format:': ' Kindle Edition'},L.K. Ras,This was a very well-written story that is appropriate for all ages. It was one of those books that you could easily read in one sitting and be sad to reach the end. The historical content was accurate to the time period and it was easy to get sucked into the story. I loved it.,Great historical fiction for young readers.,1507766400,,,0.5,26.0,The War That Saved My Life
1757,0.0,0.556,0.444,0.4926,5.0,True,"04 25, 2016",A1HPVI3HKMBFBZ,0147510481,{'Format:': ' Hardcover'},Amazon Customer,As described; arrived promptly.  Thanks!,Five Stars,1461542400,,,0.5,26.0,The War That Saved My Life
1505,0.102,0.75,0.148,0.6999,5.0,False,"02 2, 2018",A2XC6SJGZZKWY3,0147510481,{'Format:': ' Kindle Edition'},J. J. Kim,"This book is so special because it takes such hard topics while set realistically during World War II.  I could imagine reading this while teaching kids about WWII, Churchill, and Dunkirk.

The first person narrative is also compelling.  She's not the most reliable narrator but young readers can recognize that.  There's also a lot of difficult topics to discuss regarding a loveless mother and essentially, a foster situation.

Ultimately, horses help with trauma. The end. Okay it had nothing to do with that but I love reading stories with horses in it...",Historical young fiction that deals with trauma,1517529600,,,0.7,26.0,The War That Saved My Life
1782,0.0,0.721,0.279,0.7003,5.0,False,"03 10, 2016",A2MWYNT722VNDA,0147510481,{'Format:': ' Kindle Edition'},Reader Lady,Great story that adds to the growing collection of WWII realistic fiction for children and young adults.,Five Stars,1457568000,,,0.7,26.0,The War That Saved My Life
1772,0.0,0.632,0.368,0.9011,5.0,False,"03 25, 2016",A122YUQ5RE5G30,0147510481,{'Format:': ' Kindle Edition'},Jess,Loved Susan! The book was really deep and a favorite of mine. It was realistic and fiction and the author is very talented.,The war that saved my life,1458864000,,,0.9,26.0,The War That Saved My Life
1731,0.0,0.588,0.412,0.8983,5.0,True,"06 6, 2016",AMEGO8ZJJ6IRQ,0147510481,{'Format:': ' Kindle Edition'},Tamrobis,Couldn't put it down!  Would highly recommend this to middle school students and above. So glad a friend recommended it to me.,Excellent read,1465171200,,,0.9,26.0,The War That Saved My Life
1876,0.048,0.868,0.083,0.1027,3.0,False,"01 1, 2018",A3UO90FEXQNHRD,0147515823,{'Format:': ' Kindle Edition'},Kindle Customer,"This book was an eye opening journey of a young child growing up during the turbulent 60s. The prose at times was sweet, then turned harsh. But throughout the book you will find yourself in the life of  Jacqueline.",Wonderful,1514764800,,,0.1,14.0,Brown Girl Dreaming
2051,0.0,1.0,0.0,0.0,2.0,True,"08 6, 2015",APAGN445MS7AS,0147515823,{'Format:': ' Hardcover'},george dodds,did not see  - not his taste,Two Stars,1438819200,,,0.1,14.0,Brown Girl Dreaming
1880,0.087,0.765,0.148,0.2975,1.0,True,"11 14, 2017",A2BUAPM2WUAI0U,0147515823,{'Format:': ' Hardcover'},mommyso nice,"Purchased this book for a deal, just returned home to see my copy and it is really damaged. It looks like a dog was teething on it. Will have to repurchase a better copy.",Dog teether...,1510617600,,,0.3,14.0,Brown Girl Dreaming
2131,0.0,0.645,0.355,0.296,5.0,True,"02 17, 2015",A24J8365NG0XKB,0147515823,{'Format:': ' Hardcover'},O. Keister,A new American treasure for kids.,Five Stars,1424131200,,,0.3,14.0,Brown Girl Dreaming
1936,0.0,0.864,0.136,0.5023,4.0,False,"01 11, 2017",A32IJ6O8RQIR32,0147515823,{'Format:': ' Paperback'},Lindsay King-Miller,"This is a powerful story of family and childhood during a tumultuous time in American history. As poetry, it's unremarkable, but the narrative is compelling enough to make you keep reading.",This is a powerful story of family and childhood during ...,1484092800,,,0.5,14.0,Brown Girl Dreaming
2112,0.0,0.686,0.314,0.4939,5.0,True,"03 19, 2015",A1VAUSR1UH5U4V,0147515823,{'Format:': ' Kindle Edition'},Don Baker,"Newberry Honor, what else is left to say?",Very good book.,1426723200,,,0.5,14.0,Brown Girl Dreaming
2054,0.056,0.836,0.108,0.7035,4.0,True,"07 29, 2015",A27G2KT5YTNKL7,0147515823,{'Format:': ' Hardcover'},S. Barnes,"Woodson truly is a gifted writer. Her words take you back and you journey with her through her childhood. I struggled with the question, what happened to her dad? She answered that in the thankfuls at the end. The other question I had was never answered but sometimes that is a good thing, maybe the main thing is our questions. Teachers could use this to show that even though kids have trouble reading that doesn't mean they can't write. We all have stories to tell! Inspiring read!",Walk in Someone Else's Shoes,1438128000,3,,0.7,14.0,Brown Girl Dreaming
1988,0.064,0.776,0.16,0.7046,5.0,True,"06 1, 2016",A1EYI27NGNHN1R,0147515823,{'Format:': ' Kindle Edition'},Librarina,"Sometimes poetry anthologies are difficult for me to read straight through, and I certainly still took my time with this one, but it also works as a story and I thoroughly enjoyed reading it. Take your time savoring this one--don't expect a fast-paced thriller. This a captivating, nostalgic journey.",but it also works as a story and I thoroughly enjoyed reading it,1464739200,,,0.7,14.0,Brown Girl Dreaming
2150,0.0,0.738,0.262,0.9001,5.0,True,"01 8, 2015",A9WY93DAAEMVX,0147515823,{'Format:': ' Kindle Edition'},Kindle Customer,Another brilliant piece from Jacqueline Woodson. So many of her earlier works woven through the beauty of these poems. Every teacher of writing can find inspiration for his or her students among these pages.,No words to describe this,1420675200,,,0.9,14.0,Brown Girl Dreaming
2124,0.079,0.709,0.212,0.9008,5.0,False,"02 25, 2015",A3ISIVK5H0BQW0,0147515823,{'Format:': ' Kindle Edition'},SummerMeadow8,"This is amazing. A memoir in verse reflecting over her early childhood. She describes things so vividly it's hard to believe how much time has gone by since those experiences. The descriptions of her struggle with fitting in - geographically, racially, religiously, within her sibling hierarchy - made me ache for her as well as be confident in her spirit to overcome and be great. A book you wish everyone would read.",Amazing read,1424822400,,,0.9,14.0,Brown Girl Dreaming
2267,0.0,1.0,0.0,0.0,3.0,True,"02 13, 2017",A20B2ZOWYM7VV2,0307931528,{'Format:': ' Board book'},The 3 little Umipigs,I thought this was a potty training book but literally it only talks about going from diapers to underwear and nothing else.,I thought this was a potty training book but literally ...,1486944000,5,,0.1,32.0,Big Girl Panties
2235,0.0,1.0,0.0,0.0,1.0,True,"06 24, 2017",A3VOI28VFPMQVS,0307931528,{'Format:': ' Board book'},LJ&#039;s Momma,Doesn't talk about potty training at all,One Star,1498262400,,,0.1,32.0,Big Girl Panties
2309,0.0,0.0,1.0,0.296,5.0,False,"08 28, 2016",AC72SIE4RL6T2,0307931528,{'Format:': ' Board book'},patricia danielson,Ok,Five Stars,1472342400,,,0.3,32.0,Big Girl Panties
2477,0.073,0.807,0.119,0.3071,5.0,True,"09 3, 2014",A3OS764OS57AT3,0307931528,{'Format:': ' Board book'},rebekah s.,"Soooooo obnoxious for an adult but that's potty training, eh? My kid digs this book and I act like its a Shakespearean sonnet when I read it.","Dumb book, but does the job",1409702400,,,0.3,32.0,Big Girl Panties
2266,0.0,0.603,0.397,0.5093,5.0,True,"02 14, 2017",A1W4DM7GGIQHZ8,0307931528,{'Format:': ' Board book'},Kel,My Daughter's favorite potty training book!,We love this book :),1487030400,,,0.5,32.0,Big Girl Panties
2222,0.0,0.378,0.622,0.5093,5.0,True,"10 23, 2017",AAAO3PG49XSCM,0307931528,{'Format:': ' Board book'},Honey,Cute Potty Book!,Five Stars,1508716800,,,0.5,32.0,Big Girl Panties
2335,0.0,0.341,0.659,0.7003,5.0,True,"06 10, 2016",A5E941SI2K5XW,0307931528,{'Format:': ' Board book'},LB,"Hope it works, it's a gift.",Five Stars,1465516800,,,0.7,32.0,Big Girl Panties
2279,0.0,0.608,0.392,0.7003,5.0,True,"12 13, 2016",AFY62LCCJEX7M,0307931528,{'Format:': ' Board book'},momof1baby1manbaby3dogs,"Cute book, baby likes to read when she sits on potty.",Five Stars,1481587200,,,0.7,32.0,Big Girl Panties
