Id,neg,neu,pos,compound,overall,verified,reviewTime,reviewerID,asin,style,reviewerName,reviewText,summary,unixReviewTime,vote,image,target_compound,rank,title
34988,0.0,0.703,0.297,0.9001,4.0,True,"11 3, 2006",A3KB49T9FRLL73,0764152319,{'Format:': ' Hardcover'},Susan,This was an adorable book and my daughter can recite it by heart. It did inspire her to sit on the potty. It is a great tool for potty training.,Great Book,1162512000,,,0.9,39.0,"Potty Book for Girls, The (Hannah ; Henry Series)"
34648,0.034,0.622,0.344,0.8996,5.0,True,"09 14, 2017",A1AYOY1YWHIRDZ,0764152319,{'Format:': ' Hardcover'},RB,"Cute book! Was recommended for our toddler daughter who has Down Syndrome - and she loves it! Hoping this, training pants, and a potty baby will do the trick!",Cute book and catchy!,1505347200,,,0.9,39.0,"Potty Book for Girls, The (Hannah ; Henry Series)"
35240,0.171,0.547,0.281,0.1045,3.0,True,"07 29, 2015",A353UOEFUPWFR8,0803731930,{'Format:': ' Board book'},mare65,"Very limited in the number words. It's a fair, basic start.",Brief and basic,1438128000,,,0.1,49.0,Baby Signs: A Baby-Sized Introduction to Speaking with Sign Language
35280,0.181,0.601,0.218,0.1278,1.0,True,"11 14, 2014",A3W1CYE2MCTXQ8,0803731930,{'Format:': ' Board book'},J. Shinton,"Not very clear, there are much better books out there",there are much better books out,1415923200,,,0.1,49.0,Baby Signs: A Baby-Sized Introduction to Speaking with Sign Language
35124,0.0,0.0,1.0,0.296,4.0,True,"07 21, 2016",A3EA5W8PQ2MHMC,0803731930,{'Format:': ' Board book'},Emil Rogers,Ok,Four Stars,1469059200,,,0.3,49.0,Baby Signs: A Baby-Sized Introduction to Speaking with Sign Language
35063,0.0,0.774,0.226,0.3252,1.0,True,"05 23, 2017",A7DGNLYJCQK8Z,0803731930,{'Format:': ' Board book'},Lisa Burton,I could have written this book. Don't waste your money.,Useless,1495497600,,,0.3,49.0,Baby Signs: A Baby-Sized Introduction to Speaking with Sign Language
35122,0.128,0.615,0.257,0.4939,5.0,True,"08 1, 2016",ARTMVUC0DFEUL,0803731930,{'Format:': ' Board book'},Hamuel Jackson,"Love the signs, but people at my work don't understand me.  Maybe the signals are wrong.  I just want water in my meetings :hand gesture:",Not great for work,1470009600,,,0.5,49.0,Baby Signs: A Baby-Sized Introduction to Speaking with Sign Language
35128,0.0,0.556,0.444,0.4927,4.0,True,"06 19, 2016",A1II9V9KSERKUC,0803731930,{'Format:': ' Board book'},Amazon Customer,Could have more useful signs,Four Stars,1466294400,,,0.5,49.0,Baby Signs: A Baby-Sized Introduction to Speaking with Sign Language
35234,0.0,0.674,0.326,0.7003,5.0,True,"08 18, 2015",AJ7R20L5TO9VS,0803731930,{'Format:': ' Board book'},Djteach47,"Gave as a baby shower gift, so don't know, but think it is a good idea.",but think it is a good idea.,1439856000,,,0.7,49.0,Baby Signs: A Baby-Sized Introduction to Speaking with Sign Language
35053,0.0,0.341,0.659,0.7003,5.0,True,"08 5, 2017",A1BMP3NTH4CF34,0803731930,{'Format:': ' Board book'},Rosalva Reed,Good gift for a new mother,Five Stars,1501891200,,,0.7,49.0,Baby Signs: A Baby-Sized Introduction to Speaking with Sign Language
35192,0.0,0.684,0.316,0.9001,5.0,True,"12 11, 2015",A2AK3TCLQPAUAJ,0803731930,{'Format:': ' Board book'},Beachflower,The book is even thicker that I thought. It's a great value.  Our daughter-in-law had it on a wish list for her and her daughter.  Can't wait to see how she likes it.,It's a great value. Our daughter-in-law had it on a wish ...,1449792000,,,0.9,49.0,Baby Signs: A Baby-Sized Introduction to Speaking with Sign Language
35182,0.0,0.749,0.251,0.9009,5.0,True,"01 7, 2016",A2WG0QSK7NO448,0803731930,{'Format:': ' Board book'},Samantha,My kid loves this book and laughs her head off whenever we do the dog sign. She thinks it's hilarious! She hasn't started to sign back she's more interested in the colorful book but we will keep trying as long as she enjoys it.,Signing is fun,1452124800,,,0.9,49.0,Baby Signs: A Baby-Sized Introduction to Speaking with Sign Language
36330,0.133,0.724,0.142,0.0951,3.0,True,"07 15, 2013",AC899GO32OF6I,0811877825,{'Format:': ' Hardcover'},Glenda,"I think it's cute, but my 17 month old grandson didn't like it. He likes the book with the thick pages he can turn himself. Maybe he will like it when he gets older.",book,1373846400,,,0.1,8.0,"Goodnight, Goodnight Construction Site"
35499,0.177,0.696,0.127,0.0,2.0,True,"09 21, 2016",A1V5CIFX3PZZZK,0811877825,{'Format:': ' Hardcover'},DEBDEB,The spine of the book is not intact. In my opinion that is not acceptable. I'm disappointed.,Two Stars,1474416000,,,0.1,8.0,"Goodnight, Goodnight Construction Site"
35398,0.0,0.312,0.688,0.296,3.0,True,"09 9, 2017",A10DZ1U07O8S1C,0811877825,{'Format:': ' Hardcover'},Moi,It's ok.,Three Stars,1504915200,,,0.3,8.0,"Goodnight, Goodnight Construction Site"
35661,0.0,0.732,0.268,0.296,5.0,True,"10 19, 2015",A37ETDFPQPMQ1R,0811877825,{'Format:': ' Hardcover'},E. L. Robichaud,Spoiler alert: they all go to sleep.,Five Stars,1445212800,,,0.3,8.0,"Goodnight, Goodnight Construction Site"
36300,0.058,0.843,0.099,0.5047,4.0,True,"09 2, 2013",A3651KD9HLRXKQ,0811877825,{'Format:': ' Kindle Edition'},Kitchenella,I read to my grand children every night. Th 3 year old boy picks this one all the time. Th other kids also like it very much. Th only reason I am not giving 5 stars is because the text is small on the iPad so Nana has to strain a bit to see the words.,The 3 yr old loves it.,1378080000,,,0.5,8.0,"Goodnight, Goodnight Construction Site"
36032,0.0,0.833,0.167,0.4939,5.0,True,"07 30, 2014",ABJ5B5XEI2D27,0811877825,{'Format:': ' Hardcover'},SpinneyCreek,"Adorable story with rhyming words about construction vehicles winding down, finishing their day and going to bed.",Adorable story for your sleepy little one,1406678400,,,0.5,8.0,"Goodnight, Goodnight Construction Site"
35933,0.0,0.463,0.537,0.7003,5.0,True,"11 23, 2014",A2CSOXE1QL8P3Q,0811877825,{'Format:': ' Hardcover'},wscracer,A true favorite of my 2 year old grandson.,Five Stars,1416700800,,,0.7,8.0,"Goodnight, Goodnight Construction Site"
35662,0.0,0.508,0.492,0.7003,5.0,True,"10 18, 2015",A10FXUYJA86DD,0811877825,{'Format:': ' Hardcover'},perfectionist,"Good book, and even better with the PJs.",Kid success,1445126400,,,0.7,8.0,"Goodnight, Goodnight Construction Site"
35778,0.0,0.421,0.579,0.8999,5.0,True,"05 2, 2015",A1FBBLPI1WY70H,0811877825,{'Format:': ' Hardcover'},Danica Harden,Very nicely written - and with fantastic illustrations.  You'll love the characters.,Five Stars,1430524800,,,0.9,8.0,"Goodnight, Goodnight Construction Site"
36416,0.033,0.67,0.297,0.9001,5.0,True,"03 5, 2013",A2YWT3X8GFJXR2,0811877825,{'Format:': ' Hardcover'},Customer,"bought this for christmas for my almost-4 year old cousin, along with a construction hard hat & some construction trucks, and it made for a suuuper cute gift. the story is adorable & fun to read aloud.",very very cute book,1362441600,,,0.9,8.0,"Goodnight, Goodnight Construction Site"
36918,0.0,1.0,0.0,0.0,2.0,True,"09 16, 2011",A1EQA0TA4VZEZJ,0887431453,{'Format:': ' Paperback'},JJJMOM,Only buy this if you own a copier or you plan on buying a copier or even multiple copies of this book. This book us a random compilation of activities that didn't teach my preschooler anything.,Waste of money,1316131200,5,,0.1,34.0,"School Zone - Big Preschool Workbook - Ages 4 and Up, Colors, Shapes, Numbers 1-10, Alphabet, Pre-Writing, Pre-Reading, and Phonics (Big Get Ready Workbook)"
36718,0.046,0.873,0.081,0.2154,5.0,True,"08 22, 2016",A2GBJVYL2LN60V,0887431453,{'Format:': ' Paperback'},MrsWJAA,"This book is nicely huge and has perforated pages that make it easy to remove a page if you want kiddo to work independently without writing in the entire book. I have a three year old that has never really been exposed to work pages before but she was very excited when I pulled this from the box and she couldn't wait to work on it... I helped her through a few of the trace mazes and she tried. She did get frustrated after a few pages because I would insist that she try to stay within the line and not just draw a straight line from place to place, but she will learn.
I do suggest that if your child isn't familiar with this type of stuff that you walk them through a few times before letting them try on their own.",Toddler approved,1471824000,,,0.1,34.0,"School Zone - Big Preschool Workbook - Ages 4 and Up, Colors, Shapes, Numbers 1-10, Alphabet, Pre-Writing, Pre-Reading, and Phonics (Big Get Ready Workbook)"
36770,0.0,0.0,1.0,0.296,5.0,True,"08 29, 2015",A1B44YI2TEF0XY,0887431453,{'Format:': ' Paperback'},ALMO,ok,Five Stars,1440806400,,,0.3,34.0,"School Zone - Big Preschool Workbook - Ages 4 and Up, Colors, Shapes, Numbers 1-10, Alphabet, Pre-Writing, Pre-Reading, and Phonics (Big Get Ready Workbook)"
36885,0.052,0.838,0.11,0.3099,5.0,True,"08 15, 2013",AC3ANYQUO36N1,0887431453,{'Format:': ' Paperback'},Casandra J. Vandermeulen,"Bought these for a preschool group, then had more kids join. The second ""set"" of books I ordered were different from the first, even tho the cover was exactly the same....down to the number in the top corner... Was really bummed! So be careful...if you need for a group...order them all at once! :(",Some are different!,1376524800,,,0.3,34.0,"School Zone - Big Preschool Workbook - Ages 4 and Up, Colors, Shapes, Numbers 1-10, Alphabet, Pre-Writing, Pre-Reading, and Phonics (Big Get Ready Workbook)"
36729,0.0,0.686,0.314,0.4939,3.0,True,"06 12, 2016",A2BNW0ZDZ8CRFQ,0887431453,{'Format:': ' Paperback'},Nicole Brown,Pretty simple stuff- lots of mazes/trace the path.,Three Stars,1465689600,,,0.5,34.0,"School Zone - Big Preschool Workbook - Ages 4 and Up, Colors, Shapes, Numbers 1-10, Alphabet, Pre-Writing, Pre-Reading, and Phonics (Big Get Ready Workbook)"
36695,0.0,0.687,0.313,0.4927,5.0,True,"12 29, 2016",A4F1U92DFLOUW,0887431453,{'Format:': ' Paperback'},kjan63,Very good book. I will buy more of these,Makes a great gift for children getting ready for school,1482969600,,,0.5,34.0,"School Zone - Big Preschool Workbook - Ages 4 and Up, Colors, Shapes, Numbers 1-10, Alphabet, Pre-Writing, Pre-Reading, and Phonics (Big Get Ready Workbook)"
36826,0.0,0.759,0.241,0.6975,5.0,False,"09 9, 2014",AUWSAG5S652N0,0887431453,{'Format:': ' Paperback'},JaneN,Book is thick and so colorful. Love it! Would buy it again for my second child.,Love it! Would buy it again for my second ...,1410220800,,,0.7,34.0,"School Zone - Big Preschool Workbook - Ages 4 and Up, Colors, Shapes, Numbers 1-10, Alphabet, Pre-Writing, Pre-Reading, and Phonics (Big Get Ready Workbook)"
36745,0.0,0.774,0.226,0.7054,5.0,True,"02 22, 2016",A2HT7FF0J2V4PN,0887431453,{'Format:': ' Paperback'},Amazon Customer,"My 5 year old does these worksheets at home. He enjoys them and he is learning at the same time, Can't go wrong.",My 5 year old does these worksheets at home. ...,1456099200,,,0.7,34.0,"School Zone - Big Preschool Workbook - Ages 4 and Up, Colors, Shapes, Numbers 1-10, Alphabet, Pre-Writing, Pre-Reading, and Phonics (Big Get Ready Workbook)"
36878,0.047,0.663,0.29,0.9,5.0,True,"12 16, 2013",A3GW5E7PCAZYGP,0887431453,{'Format:': ' Paperback'},HAPPY,My little one enjoyed this so much! I literally had to ask to save some pages for the next day. Loved it so much that it wasn't like work at all. Very engaging & would buy again.,My Preschooler loved it!,1387152000,,,0.9,34.0,"School Zone - Big Preschool Workbook - Ages 4 and Up, Colors, Shapes, Numbers 1-10, Alphabet, Pre-Writing, Pre-Reading, and Phonics (Big Get Ready Workbook)"
36860,0.0,0.749,0.251,0.9013,4.0,True,"04 24, 2014",A9BLPJWELT8SC,0887431453,{'Format:': ' Paperback'},10apples,This has been my favorite preschool activity book so far.  It has a lot of variety and is very refreshing.  We are almost finished with it and I thinks the first one we will actually finish!  Very colorful and fun.  Definitely recommend.,Fun with different kinds of activities for variety.,1398297600,,,0.9,34.0,"School Zone - Big Preschool Workbook - Ages 4 and Up, Colors, Shapes, Numbers 1-10, Alphabet, Pre-Writing, Pre-Reading, and Phonics (Big Get Ready Workbook)"
36982,0.058,0.878,0.064,0.0498,3.0,True,"07 12, 2016",A1IK61ZE115ITM,0961519762,{'Format:': ' Hardcover'},G&amp;K,"Story was okay, a little unclear. Probably wouldn't order from the seller again as it didn't mention that the whole inside cover was filled with a personal message to someone.","Story was okay, a little unclear. Probably wouldn't ...",1468281600,,,0.1,46.0,Tear Soup: A Recipe for Healing After Loss
37088,0.0,1.0,0.0,0.0,2.0,True,"09 30, 2014",ARDX43TZFJ6GH,0961519762,{'Format:': ' Hardcover'},Eskimino Thunderbunny,This book has a lot of typos and I don't know how it got published with so little editing...,Two Stars,1412035200,2,,0.1,46.0,Tear Soup: A Recipe for Healing After Loss
37046,0.275,0.392,0.333,0.296,5.0,True,"03 26, 2015",A2BJSCMN59FC03,0961519762,{'Format:': ' Hardcover'},BIG DAVE 101,"good for anyone grieving the loss of a loved one, for all ages.",great therapy,1427328000,,,0.3,46.0,Tear Soup: A Recipe for Healing After Loss
37257,0.066,0.814,0.12,0.296,5.0,True,"02 19, 2007",A2F97T48GL0F54,0961519762,{'Format:': ' Hardcover'},Bibliophile@heart,"This book is appropriate for most all ages. I have yet to use it with any kids in the schools, however, I've read through it a few times and been impressed with the lasting impression it leaves. The book doesn't push any particular ideology of death and afterlife,although it does make reference to god.","Simple, true, and relevant",1171843200,,,0.3,46.0,Tear Soup: A Recipe for Healing After Loss
36997,0.0,0.556,0.444,0.4939,3.0,True,"02 5, 2016",A3OIWNY8BP4QW9,0961519762,{'Format:': ' Hardcover'},Elaine Duerre,Cute...great pictures...I did enjoy it.,great pictures.,1454630400,,,0.5,46.0,Tear Soup: A Recipe for Healing After Loss
37108,0.061,0.82,0.119,0.4926,5.0,True,"04 26, 2014",A2GF8RBC7MWICT,0961519762,{'Format:': ' Hardcover'},Grace Hochstetler,L buy this book to give away as gifts and I love it! I've read it often myself especially while going through the loss of my Mother. The pictures say as much as the words.,Great book!,1398470400,,,0.5,46.0,Tear Soup: A Recipe for Healing After Loss
36966,0.0,0.655,0.345,0.7003,5.0,True,"10 16, 2016",AZA5NGVSAQW7L,0961519762,,Diana Marie Newton,Gave it as a gift because it was a gift for me when I read it.,Excellent resource,1476576000,,,0.7,46.0,Tear Soup: A Recipe for Healing After Loss
36956,0.094,0.615,0.291,0.7003,5.0,True,"02 22, 2017",A6JIGY538B9V5,0961519762,{'Format:': ' Hardcover'},Janice E. Bosman,Tear Soup offers such a compassionate story that I have gifted it to three people who have lost loved ones.,Compassionate Reading,1487721600,,,0.7,46.0,Tear Soup: A Recipe for Healing After Loss
37194,0.093,0.55,0.356,0.9001,5.0,True,"01 15, 2012",A2QLLZE8U4CI4M,0961519762,{'Format:': ' Hardcover'},Pinky,This is one of the best books for families on the death of a loved one.  I loved it.  It is written in language suitable for all family members.  Thanks.,Wonderful read,1326585600,,,0.9,46.0,Tear Soup: A Recipe for Healing After Loss
37020,0.107,0.324,0.569,0.8996,5.0,True,"08 6, 2015",AYIL8KJDFMD9L,0961519762,{'Format:': ' Hardcover'},PVR,"So, so beautiful. Great gift for anyone who has experienced a loss.",Beautiful story to help understand what grieving people are going through.,1438819200,,,0.9,46.0,Tear Soup: A Recipe for Healing After Loss
37464,0.073,0.832,0.095,0.0862,3.0,False,"02 19, 2016",A9D3VM4WVFOI4,1416980067,{'Format:': ' Hardcover'},Meghan,"I finally figured out what the Dork Diaries books are all about.
Funny and a smart, Nikki Maxwell is trying to figure out how her life works now that she's started a new school.  She wants to be popular and a part of the in crowd, but it doesn't seem like that's happening for her.
For full review: [...]",Dork Diaries is Funny and Gets Kids Reading,1455840000,,,0.1,41.0,Dork Diaries 1: Tales from a Not-So-Fabulous Life
37711,0.101,0.787,0.112,0.0772,1.0,True,"05 13, 2014",A3GAW8K0E2X4B0,1416980067,{'Format:': ' Kindle Edition'},Isabella,"I disliked it if I chose a favorite I would not be this one so do not wast your money on it
It is only a girls diary",good but it was not a bit funny,1399939200,,,0.1,41.0,Dork Diaries 1: Tales from a Not-So-Fabulous Life
37704,0.14,0.687,0.173,0.296,5.0,True,"06 7, 2014",AYXONHLONGL5J,1416980067,{'Format:': ' Kindle Edition'},Amazon Customer,It's a amazing book you have really got to read this if you have problems in your life like you think your a dork this is the book to go to,Read this 10 times you will so get her life.,1402099200,,,0.3,41.0,Dork Diaries 1: Tales from a Not-So-Fabulous Life
37386,0.114,0.747,0.14,0.285,1.0,False,"10 29, 2016",A2V6TU4BCZ9QVW,1416980067,{'Format:': ' Kindle Edition'},zoe,"Wow, I can't believe I used to like this series. While bored, I picked this book off my shelf to try and reread it. I'm shocked that the word ""SKANK"" is used in this book!

Nikki claims to be a dork. I actually snorted. She is just like MacKenzie, the clich mean girl. Both are rude, care way too much about looks and try their best to get the attention of a sweet, kind boy who I hope ends up with someone else when he is older.

The most apalling quotes? ""You FAT, worthless WANNA-BES!"" and ""Don't you need a LICENSE to be that UGLY?"" Cringe. 9-year-olds should not be reading this.

Isn't it terrible to have a daughter you love but is TERRIBLE to you? That's Nikki. I rolled my eyes when she called MacKenzie rude, because that is also the word to describe Nikki.",Tacky + Inappropriate,1477699200,4,,0.3,41.0,Dork Diaries 1: Tales from a Not-So-Fabulous Life
37953,0.134,0.67,0.196,0.4939,5.0,True,"01 11, 2013",A3CTZLTF3AJWH,1416980067,{'Format:': ' Kindle Edition'},Natalie Lima,Thus book is the best book in the series. It is about a girl and her life as a dork how changes in and out through a dork and a popular person,Good book,1357862400,,,0.5,41.0,Dork Diaries 1: Tales from a Not-So-Fabulous Life
37916,0.0,0.875,0.125,0.5067,5.0,False,"02 22, 2013",AG5TPZ4RWP1PQ,1416980067,{'Format:': ' Kindle Edition'},yasmeen,"So many situations for Nikki see what all the fuss is about in Nikki's newest adventures. I would read it over and over again!!!
B)",Laugh out loud funny,1361491200,,,0.5,41.0,Dork Diaries 1: Tales from a Not-So-Fabulous Life
37684,0.0,0.256,0.744,0.7003,4.0,True,"08 6, 2014",AVQFQOBR90YIL,1416980067,{'Format:': ' Hardcover'},Visa,good book and funny,Four Stars,1407283200,,,0.7,41.0,Dork Diaries 1: Tales from a Not-So-Fabulous Life
37755,0.0,0.775,0.225,0.7003,5.0,True,"01 11, 2014",A1IV63947PWBP3,1416980067,{'Format:': ' Hardcover'},djay67,"There is nothing I can add. The book was in new condition,it was what I wanted(it was a Christmas gift for my niece)at a good price.",Everything was fine,1389398400,,,0.7,41.0,Dork Diaries 1: Tales from a Not-So-Fabulous Life
37280,0.086,0.721,0.193,0.9001,5.0,False,"06 15, 2009",A3K9XCXDV6W07N,1416980067,{'Format:': ' Hardcover'},T. Stapleton,"I picked this book up on a whim, curious to see if it was anything like the vastly popular Wimpy Kid books, and to my joy it was.  Written as the diary of a middle school girl, Dork Diaries chronicles Nikki's days as she navigates the ups and downs of a new school, embarrassing parents, and an adorably quirky little sister.

Filled with fun illustrations, and fonts that keep you looking, Rachel Renee Russell has created for girls what Jeff Kinney did for boys with his Wimpy Kids series.",Diary of a Wimpy Kid for girls!,1245024000,2,,0.9,41.0,Dork Diaries 1: Tales from a Not-So-Fabulous Life
37821,0.0,0.56,0.44,0.8997,5.0,True,"07 19, 2013",A2K1HZQBJ1GTOF,1416980067,{'Format:': ' Kindle Edition'},Anne Conrad,I loved this book it is very humorous I found myself reading it over and over again I loved it!,Amazing book,1374192000,,,0.9,41.0,Dork Diaries 1: Tales from a Not-So-Fabulous Life
38227,0.044,0.908,0.048,0.0567,3.0,True,"02 16, 2017",ANJGAIOYSOL7H,1419708457,{'Format:': ' Hardcover'},E3Mama,"It's not my favorite. The plot is mediocre. The characters are not developed enough (yes, I'm aware that this is a children's book). The hair over the eye is a bit emo. I wish I'd borrowed it from the library as opposed to buying it. The book did not hold my 5yo dds attention, or mine.",Wish I'd gotten it from the library first,1487203200,,,0.1,3.0,"Rosie Revere, Engineer"
38529,0.172,0.643,0.186,0.05,3.0,True,"07 10, 2014",A3PD4ATHSXH42L,1419708457,{'Format:': ' Hardcover'},Marie-Louise Ward,This was not as good as I'd hoped it would be.,Three Stars,1404950400,,,0.1,3.0,"Rosie Revere, Engineer"
38435,0.0,0.872,0.128,0.3352,4.0,True,"04 7, 2015",AJUTW7KLND19V,1419708457,{'Format:': ' Hardcover'},Curlooley,"This is a good choice for all children, but particularly little girls.  I want my granddaughter to understand the sky is the limit for her career choices.",INSPIRING,1428364800,,,0.3,3.0,"Rosie Revere, Engineer"
38493,0.157,0.571,0.272,0.3449,4.0,True,"11 14, 2014",A32665RYJFW541,1419708457,{'Format:': ' Hardcover'},SMBS,Very nice story about not letting your insecurities hold you back! Never quit. Great book.,Really nice!,1415923200,,,0.3,3.0,"Rosie Revere, Engineer"
38373,0.0,0.866,0.134,0.5023,4.0,False,"10 21, 2015",A3T2B1L2UHKY02,1419708457,{'Format:': ' Kindle Edition'},Redstone Guy,It took me about 30 seconds to read this. But I think you'll like it its Not a chapter book but it has color,Short but good,1445385600,,,0.5,3.0,"Rosie Revere, Engineer"
38391,0.0,0.652,0.348,0.4939,2.0,True,"08 21, 2015",A4ZFYF306CGBD,1419708457,{'Format:': ' Hardcover'},Gramma V,will save for when grans are older,Two Stars,1440115200,,,0.5,3.0,"Rosie Revere, Engineer"
38137,0.0,0.58,0.42,0.7003,5.0,True,"09 11, 2017",A26KHLTHQVZGWA,1419708457,{'Format:': ' Hardcover'},David B.,This was a cute story and our 7 year old liked it.,Good read!,1505088000,,,0.7,3.0,"Rosie Revere, Engineer"
38184,0.11,0.667,0.224,0.7003,5.0,False,"05 12, 2017",AXD69UHY4WA9P,1419708457,{'Format:': ' Kindle Edition'},Amazon Customer,This book touches on the fragile confidence that children have. Even innocent teasing can cause sensitive children to give up. Rosie learns that failure is an expected step on the road to success.,Wonderful!,1494547200,,,0.7,3.0,"Rosie Revere, Engineer"
38462,0.116,0.628,0.257,0.9001,3.0,True,"01 15, 2015",A10JVKJBRE9SVG,1419708457,{'Format:': ' Hardcover'},vatreehugger,"It's okay, though I had hoped for more.....I was expecting something more along the lines of Andrew Henry's Meadow. I was mostly just disappointed that the girl didn't actually ""do"" much. It certainly has a good lesson about not giving up and taking mistakes as a learning opportunity rather than getting frustrated and giving up, but I was hoping to see a lot more fun ingenuity and creation.",Meh...,1421280000,,,0.9,3.0,"Rosie Revere, Engineer"
38276,0.0,0.333,0.667,0.9001,5.0,True,"09 12, 2016",A3MN1CGCU6JKAP,1419708457,{'Format:': ' Hardcover'},Jbs3035,Yes. Yes. Yes. BUY THIS BOOK. Beautiful in every way,Beautiful in every,1473638400,,,0.9,3.0,"Rosie Revere, Engineer"
38617,0.0,0.882,0.118,0.2838,5.0,False,"10 3, 2017",A1DR70E3QCNK25,1423133080,{'Format:': ' Hardcover'},Cindy Sanders,Really a cute book. Bought the stuffed elephant but could not get the book at the same place.,Good story,1506988800,,,0.1,7.0,We Are in a Book! (An Elephant and Piggie Book)
38863,0.0,0.952,0.048,0.3054,3.0,False,"10 4, 2013",A1XFKEY7KJ1TNU,1423133080,{'Format:': ' Hardcover'},Mzchordz,"I think this is one of those books Mo wrote in a hurry. It's entertaining, but it doesn't measure up to the others. That doesn't mean we don't read it 20 times a day, however. A hint of existentialism? I don't know, I might be reading too much into these books!",Our kid likes it,1380844800,2,,0.1,7.0,We Are in a Book! (An Elephant and Piggie Book)
38863,0.0,0.952,0.048,0.3054,3.0,False,"10 4, 2013",A1XFKEY7KJ1TNU,1423133080,{'Format:': ' Hardcover'},Mzchordz,"I think this is one of those books Mo wrote in a hurry. It's entertaining, but it doesn't measure up to the others. That doesn't mean we don't read it 20 times a day, however. A hint of existentialism? I don't know, I might be reading too much into these books!",Our kid likes it,1380844800,2,,0.3,7.0,We Are in a Book! (An Elephant and Piggie Book)
38617,0.0,0.882,0.118,0.2838,5.0,False,"10 3, 2017",A1DR70E3QCNK25,1423133080,{'Format:': ' Hardcover'},Cindy Sanders,Really a cute book. Bought the stuffed elephant but could not get the book at the same place.,Good story,1506988800,,,0.3,7.0,We Are in a Book! (An Elephant and Piggie Book)
38686,0.104,0.73,0.166,0.4939,5.0,False,"07 17, 2016",A174S4A48ZW5F1,1423133080,{'Format:': ' Hardcover'},Grabowski,"Both my kids (ages 3 and 5) are obsessed with this series. Clever, funny, and meta, there's enough here to keep mom and dad from fatigue after the thousandth read through.",My kids love these books,1468713600,,,0.5,7.0,We Are in a Book! (An Elephant and Piggie Book)
38898,0.062,0.787,0.152,0.4939,5.0,True,"02 14, 2013",A2RG7Z1PPL2GVC,1423133080,{'Format:': ' Hardcover'},Patti,Bought this book for several friend's children.  I had seen the book before and wanted it.  Getting it on line was a perfect way to avoid the shipping cost because I have amazon prime,Adorable,1360800000,,,0.5,7.0,We Are in a Book! (An Elephant and Piggie Book)
38613,0.0,0.455,0.545,0.6988,5.0,True,"10 17, 2017",A27A3OTVIT9NE2,1423133080,{'Format:': ' Hardcover'},jancan,one of Mo Willems best!!,Five Stars,1508198400,,,0.7,7.0,We Are in a Book! (An Elephant and Piggie Book)
